Brand,Name,Size,Price,Availible,Page,Link
Chrome Hearts,Christmas CH Matty Boy Set Hoodie & Pants,Size: S/M (30-34),"$1,000.00",True,1.0,https://ypcollective.com/products/ch-matty-boy-christmas-hoodie
Chrome Hearts,22k Pink Sapphire CH Tiny Plus Bracelet,N/A,N/A,True,1.0,https://ypcollective.com/products/ch-tiny-plus-gold-pink-sapphire-bracelet
Chrome Hearts,1/1 Multi Color Cross Patch Pillow,N/A,"$14,000.00",True,1.0,https://ypcollective.com/products/multi-color-cross-patch-pillow
Chrome Hearts,CH Leather Dog Doll,N/A,"$4,600.00",True,1.0,https://ypcollective.com/products/ch-dog-doll-plush-toy
Chrome Hearts,Multi Color Cross Patch Mini Taka,N/A,"$19,200.00",True,1.0,https://ypcollective.com/products/multi-color-cross-patch-taka-bag
Chrome Hearts,Star Patch Cashmere Balaclava Mask,N/A,"$5,000.00",True,1.0,https://ypcollective.com/products/mask
Chrome Hearts,Matty Boy Chomper 99eyes Flame Pin,N/A,$160.00,True,1.0,https://ypcollective.com/products/matty-boy-stay-fast-pin-copy
Chrome Hearts,CH Mikimoto Pearl CH Plus Earrings Set,N/A,N/A,True,1.0,https://ypcollective.com/products/ch-x-mikimoto-white-gold-pearl-earrings
Chrome Hearts,Matty Boy Sex Records Car Pin,N/A,$150.00,True,1.0,https://ypcollective.com/products/matty-boy-sex-records-buick-pin-copy
Chrome Hearts,Matty Boy Sex Records Pin,N/A,$180.00,True,1.0,https://ypcollective.com/products/sex-records-pin-copy
Chrome Hearts,Black Teddy Bear Plush W/ Dagger Necklace,N/A,"$2,950.00",True,1.0,https://ypcollective.com/products/black-teddy-bear-w-dagger-necklace
Chrome Hearts,Cutout Plus Wallet Chain,N/A,"$6,450.00",True,1.0,https://ypcollective.com/products/cutout-plus-wallet-chain-2
Chrome Hearts,St. Barth Exclusive Pullover Hoodie,Size: L / XL,"$1,280.00",True,1.0,https://ypcollective.com/products/st-barth-exclusive-pullover-hoodie
Chrome Hearts,Red Cross Patch Cemetery Belt,N/A,N/A,True,1.0,https://ypcollective.com/products/red-cross-patch-cemetery-belt
Chrome Hearts,Cashmere 'Hit & Run' Zebra Cross Patch Cardigan,Size: M,"$4,500.00",True,1.0,https://ypcollective.com/products/cashmere-hit-run-zebra-cross-patch-cardigan
Chrome Hearts,Beast III Ebony Wood Sunglasses,N/A,"$2,280.00",True,1.0,https://ypcollective.com/products/beast-iii-sunglasses
Chrome Hearts,Braided Leather Belt Strap,N/A,N/A,True,1.0,https://ypcollective.com/products/black-belt
Chrome Hearts,RS3 Triple Cross Denim Hat,Size: OS,$525.00,True,1.0,https://ypcollective.com/products/rs3-triple-cross-baseball-cap
Chrome Hearts,CH Mikimoto Pearl Baby Fat Charm Bracelet,N/A,N/A,True,1.0,https://ypcollective.com/products/ch-x-mikimoto-white-gold-pearl-bracelet
Chrome Hearts,Floral Square Buckle Belt,Size: 36,"$1,495.00",True,1.0,https://ypcollective.com/products/leather-scroll-buckle-belt
Chrome Hearts,CH Trydixagain Titanium Glasses,N/A,"$1,400.00",True,1.0,https://ypcollective.com/products/ch-trydixagain-red-frame-glasses-copy
Chrome Hearts,CH Gittin' Any? Glasses,N/A,N/A,True,1.0,https://ypcollective.com/products/ch-gold-gittin-any-copy
Chrome Hearts,CH Plus Windbreaker Jacket 'Match Point',N/A,N/A,True,1.0,https://ypcollective.com/products/match-point-monogram-windbreaker-jacket-copy
Chrome Hearts,Sex Records Cross Patch Carhartt Double Knee Carpenter Pants,N/A,N/A,True,1.0,https://ypcollective.com/products/sex-records-cross-patch-carhartt-carpenter-jeans-1
Chrome Hearts,CH Shearling Bear Home Plush Toy 'Unstuffer',N/A,"$1,995.00",True,2.0,https://ypcollective.com/products/bear
Chrome Hearts,Black Miami Exclusive Hoodie,Size: L,"$1,000.00",True,2.0,https://ypcollective.com/products/black-miami-exclusive-hoodie
Chrome Hearts,Pink Sapphire Tiny E Bracelet,"Size: 7"" / 11 Links","$4,500.00",True,2.0,https://ypcollective.com/products/silver-pink-sapphire-tiny-e-bracelet
Chrome Hearts,CH Scroll Display Plaque,"Size: 7.5""",$750.00,True,2.0,https://ypcollective.com/products/ch-scroll-display-plaque
Chrome Hearts,Multi Color Cross Patch Belt,Size: 38,"$9,995.00",True,2.0,https://ypcollective.com/products/multi-color-cross-patch-belt
Chrome Hearts,Black Leather Belt Strap,N/A,N/A,True,2.0,https://ypcollective.com/products/black-leather-belt-strap-4
Chrome Hearts,CH Hand Painted Ceramic Plates,N/A,$895.00,True,2.0,https://ypcollective.com/products/ch-ceramic-plates
Chrome Hearts,Green Cross Patch Zebra Mini Taka Bag,N/A,"$7,000.00",True,2.0,https://ypcollective.com/products/ch-pony-hair-taka-bag
Chrome Hearts,Matty Boy Chomper Lips Beanie,N/A,$400.00,True,2.0,https://ypcollective.com/products/ch-black-chomper-matty-boy-beanie
Chrome Hearts,Green Matty Boy Spec Beanie,N/A,N/A,True,2.0,https://ypcollective.com/products/wool-ch-plus-logo-beanie-1
Chrome Hearts,Black Leather Belt Strap,N/A,N/A,True,2.0,https://ypcollective.com/products/black-leather-belt-strap-3
Chrome Hearts,Cemetery Cross Black Belt,N/A,N/A,True,2.0,https://ypcollective.com/products/cemetery-cross-black-belt
Chrome Hearts,CH Buckle Black Belt,Size: 36,"$3,700.00",True,2.0,https://ypcollective.com/products/ch-buckle-black-belt
Chrome Hearts,Black Leather Gunslinger Belt,N/A,N/A,True,2.0,https://ypcollective.com/products/gunslinger-belt
Chrome Hearts,Multi Color Cross Patch Belt Cemetery Cross Buckle,N/A,N/A,True,2.0,https://ypcollective.com/products/ch-multi-color-cross-patch-belt-w-cemetery-cross-buckle
Chrome Hearts,Ruby Tiny E Bracelet,"Size: 7.5"" / 12 Links","$5,400.00",True,2.0,https://ypcollective.com/products/silver-ruby-tiny-e-bracelet
Chrome Hearts,CH Tiny Plus Silver Bracelet,"Size: 8.25"" / 20 Links","$2,950.00",True,2.0,https://ypcollective.com/products/ch-tiny-plus-silver-bracelet
Chrome Hearts,Blue Sapphire CH Tiny Plus Bracelet,"Size: 7.25""-7.5""/18 Links","$8,500.00",True,2.0,https://ypcollective.com/products/ch-tiny-plus-silver-blue-sapphire-bracelet
Chrome Hearts,22k Gold Emerald Tiny E Bracelet,"Size: 7.5"" / 12 Links","$14,500.00",True,2.0,https://ypcollective.com/products/gold-emerald-tiny-e-bracelet
Chrome Hearts,Wool CH Plus Logo Beanie,N/A,N/A,True,2.0,https://ypcollective.com/products/wool-ch-plus-logo-beanie
Chrome Hearts,CH Dice Crossball Bracelet,"Size: 8.25"" / 9 Links","$3,150.00",True,2.0,https://ypcollective.com/products/dice-bracelet-1
Chrome Hearts,Paper Chain Dice Keychain,N/A,N/A,True,2.0,https://ypcollective.com/products/dice-paperchain-keychain-2
Chrome Hearts,CH Quilted Flannel Jacket - 'WORK'N',N/A,N/A,True,2.0,https://ypcollective.com/products/ch-quilted-flannel-jacket-workn
Chrome Hearts,Rolling Stones Zip Hoodie,N/A,N/A,True,2.0,https://ypcollective.com/products/rolling-stones-las-vegas-exclusive-zip-hoodie
Chrome Hearts,22k Gold Ruby Tiny E Bracelet,N/A,N/A,True,3.0,https://ypcollective.com/products/gold-ruby-tiny-e-bracelet
Chrome Hearts,Pink Sapphire Baby Spoon Filigree,N/A,"$2,600.00",True,3.0,https://ypcollective.com/products/ch-silver-pink-sapphire-spoon
Chrome Hearts,CH Plus Stiff V2 Puffer Jacket,Size: XL,"$6,000.00",True,3.0,https://ypcollective.com/products/monogram-plus-stiff-v2-puffer-jacket
Chrome Hearts,CH Ebony Wood Saw,N/A,"$3,000.00",True,3.0,https://ypcollective.com/products/ch-wooden-saw
Chrome Hearts,CH Silver Safety Pin,N/A,$600.00,True,3.0,https://ypcollective.com/products/ch-silver-pin
Chrome Hearts,Matty Boy 99 Eyes Chomper Checker Socks,N/A,From $150.00,True,3.0,https://ypcollective.com/products/ch-socks
Chrome Hearts,'FUCK YOU' CH Striped Socks,N/A,From $150.00,True,3.0,https://ypcollective.com/products/ch-striped-sock-3-pack
Chrome Hearts,Christmas CH Matty Boy Set Hoodie & Pants,Size: S/M (30-34),"$1,000.00",True,3.0,https://ypcollective.com/products/ch-matty-boy-christmas-pajamas
Chrome Hearts,Art Basel Miami Exclusive T-Shirt,Size: L,From $600.00,True,3.0,https://ypcollective.com/products/ch-art-basel-miami-t-shirt
Chrome Hearts,CH Neck Logo LS T-Shirt,Size: M,From $550.00,True,3.0,https://ypcollective.com/products/ch-neck-logo-ls-t-shirt
Chrome Hearts,CH Horseshoe Floral LS T-Shirt,N/A,N/A,True,3.0,https://ypcollective.com/products/ch-horseshoe-floral-ls-t-shirt
Chrome Hearts,'STAFF' CH Horseshoe Pocket LS T-Shirt,Size: S,$380.00,True,3.0,https://ypcollective.com/products/staff-ch-horseshoe-pocket-ls-t-shirt-1
Chrome Hearts,'STAFF' CH Horseshoe LS T-Shirt,Size: S,$395.00,True,3.0,https://ypcollective.com/products/staff-ch-horseshoe-pocket-ls-t-shirt
Chrome Hearts,Lamb Leather Puffer Vest,Size: S,"$5,000.00",True,3.0,https://ypcollective.com/products/ch-black-leather-puffer-vest
Chrome Hearts,"Cemetery Cross Buckle - 1.5""",N/A,N/A,True,3.0,https://ypcollective.com/products/cemetery-cross-buckle-1-6
Chrome Hearts,CH Multi Color Cross Patch Belt w/ CH Buckle,Size: 38,"$12,950.00",True,3.0,https://ypcollective.com/products/ch-multi-color-cross-patch-belt-w-ch-buckle
Chrome Hearts,Red Cross Patch Cemetery Belt,N/A,N/A,True,3.0,https://ypcollective.com/products/red-cross-patch-cemetery-belt-1
Chrome Hearts,Cemetery Cross Red Belt,N/A,N/A,True,3.0,https://ypcollective.com/products/cemetery-cross-red-belt
Chrome Hearts,Blue Cemetery Cross Belt,N/A,N/A,True,3.0,https://ypcollective.com/products/blue-cemetery-cross-belt-1
Chrome Hearts,Camo Cross Patch Wave Zipper Wallet,N/A,N/A,True,3.0,https://ypcollective.com/products/camo-cross-patch-wave-zipper-wallet
Chrome Hearts,Star Patch Selvedge Denim,Size: 32,"$5,500.00",True,3.0,https://ypcollective.com/products/star-patch-cross-patch-denim-1
Chrome Hearts,Cross Patch Henley Button Up Shirt,Size: S,$780.00,True,3.0,https://ypcollective.com/products/grey-henley-button-up-shirt
Chrome Hearts,CH Quilted Flannel Jacket - 'WORK'N',N/A,N/A,True,3.0,https://ypcollective.com/products/flannel
Chrome Hearts,CH Baseball Cross Patch Hat,N/A,N/A,True,3.0,https://ypcollective.com/products/ch-baseball-cross-patch-hat-1
Chrome Hearts,CH Baseball Cross Patch Hat,N/A,N/A,True,4.0,https://ypcollective.com/products/ch-baseball-cross-patch-hat-copy
Chrome Hearts,CH Baseball Cross Patch Hat,N/A,N/A,True,4.0,https://ypcollective.com/products/ch-baseball-cross-patch-hat
Chrome Hearts,NYC Exclusive CH Trucker Hat,N/A,N/A,True,4.0,https://ypcollective.com/products/ch-new-york-exclusive-black-trucker-hat
Chrome Hearts,Sex Records Cross Patch Shorts,N/A,N/A,True,4.0,https://ypcollective.com/products/sex-records-cross-patch-shorts-1
Chrome Hearts,Silver Lace Locks,N/A,$795.00,True,4.0,https://ypcollective.com/products/ch-shoelace-plates-locks
Chrome Hearts,Vertical Logo Denim Hat,Size: OS,$525.00,True,4.0,https://ypcollective.com/products/vertical-logo-denim-hat
Chrome Hearts,Cashmere Cross Patch Hoodie,Size: M,"$4,200.00",True,4.0,https://ypcollective.com/products/cashmere-cross-patch-hoodie
Chrome Hearts,Blue Cross Patch Levi's Jeans,N/A,N/A,True,4.0,https://ypcollective.com/products/blue-wash-cross-patch-levis-jeans
Chrome Hearts,Levi's Stencil Cross Patch Jeans,N/A,N/A,True,4.0,https://ypcollective.com/products/blue-stencil-cross-patch-denim
Chrome Hearts,Multi Color Cross Patch Converse Chuck Taylor,N/A,N/A,True,4.0,https://ypcollective.com/products/ch-multi-color-cross-patch-converse
Chrome Hearts,Cross Patch Converse Chuck Taylor,N/A,N/A,True,4.0,https://ypcollective.com/products/cross-patch-converse-shoes
Chrome Hearts,Vine Dagger Embroidered Denim Hat,Size: OS,$460.00,True,4.0,https://ypcollective.com/products/black-dagger-trucker-hat
Chrome Hearts,Dagger Stud Vintage Leather Belt,N/A,N/A,True,4.0,https://ypcollective.com/products/black-leather-dagger-belt
Chrome Hearts,Pink Gunslinger Belt,N/A,N/A,True,4.0,https://ypcollective.com/products/pink-gunslinger-belt
Chrome Hearts,White Leather Cemetery Cross Patch Backpack,N/A,N/A,True,4.0,https://ypcollective.com/products/white-cemetery-cross-backpack
Chrome Hearts,Cross Patch Double Knee Carpenter Pants,N/A,N/A,True,4.0,https://ypcollective.com/products/brown-cross-patch-denim-chinos
Chrome Hearts,Stencil Cross Patch Levi's Jeans,N/A,N/A,True,4.0,https://ypcollective.com/products/stencil-cross-patch-denim-jeans
Chrome Hearts,Sex Records Green Cross Patch Levi's Jeans,N/A,N/A,True,4.0,https://ypcollective.com/products/green-cross-patch-denim-jeans
Chrome Hearts,Blue Denim Cross Patch Levi's Jeans,N/A,N/A,True,4.0,https://ypcollective.com/products/1-1-blue-denim-cross-patch-jeans
Chrome Hearts,Cow Fur Triple Cross Boston Duffle Bag,N/A,"$9,000.00",True,4.0,https://ypcollective.com/products/cow-leather-paris-exclusive-duffle-bag
Chrome Hearts,Multi Color Cross Patch Duffle Bag Large (S),N/A,"$30,000.00",True,4.0,https://ypcollective.com/products/1-1-multi-color-cross-patch-large-duffle-bag
Chrome Hearts,CH Plus Cross Buckle Red Belt,N/A,N/A,True,4.0,https://ypcollective.com/products/ch-buckle-red-belt
Chrome Hearts,CH Shoelace Plates / Locks,N/A,N/A,True,4.0,https://ypcollective.com/products/lace-locks
Chrome Hearts,8mm Howlite Beaded SIlver Cross Bracelet,N/A,N/A,True,4.0,https://ypcollective.com/products/howlite-beaded-silver-cross-bracelet
Chrome Hearts,CH Buckle Black Belt,Size: 36,"$3,850.00",True,5.0,https://ypcollective.com/products/large-oval-cross-black-belt-copy
Chrome Hearts,CH Plus Cross Buckle White Belt,N/A,N/A,True,5.0,https://ypcollective.com/products/white-leather-belt-strap-1
Chrome Hearts,Large Oval Cross Black Belt,N/A,N/A,True,5.0,https://ypcollective.com/products/oval-cross-black-leather-belt
Chrome Hearts,CH Plus Cross Buckle Black Belt,Size: 36,"$3,000.00",True,5.0,https://ypcollective.com/products/black-leather-belt-strap-copy
Chrome Hearts,CH Plus Cabinet Key Hole Cover .925 Silver,"Size: Key Cover, Full Set","From $1,500.00",True,5.0,https://ypcollective.com/products/furniture-cabinet-drawer-set
Chrome Hearts,Cutout Plus Cabinet Pull .925 Silver,"Size: Cabinet Pull, Full Set","From $1,000.00",True,5.0,https://ypcollective.com/products/plus-cabinet-key-hole-cover
Chrome Hearts,CH Plus Scroll Drawer Pull,"Size: Drawer Pull, Full Set","From $1,000.00",True,5.0,https://ypcollective.com/products/plus-scroll-drawer-pull
Chrome Hearts,CH Plus Cross Buckle Blue Belt,Size: 38,"$4,850.00",True,5.0,https://ypcollective.com/products/square-plus-cross
Chrome Hearts,Long Fancy Link Bracelet,N/A,N/A,True,5.0,https://ypcollective.com/products/fancy-link-bracelet-1
Chrome Hearts,Black Leather Belt Strap,Size: 36,$950.00,True,5.0,https://ypcollective.com/products/black-leather-belt-strap-2
Chrome Hearts,1/1 Multi Motif Logo Bracelet Fleur Lobster Clasp,"Size: 9.5""","$3,760.00",True,5.0,https://ypcollective.com/products/multi-logo-bracelet-plus-link-fleur-clasp
Chrome Hearts,Large Oval Cross Buckle Red Cross Patch Destroyer Belt,N/A,N/A,True,5.0,https://ypcollective.com/products/oval-cross-buckle-red-cross-patch-destroyer-belt
Chrome Hearts,Large Oval Cross Buckle Black Cross Patch Cemetery Belt,N/A,N/A,True,5.0,https://ypcollective.com/products/black-cross-patch-oval-belt-strap
Chrome Hearts,CH Buckle Red Cross Patch Destroyer Belt,Size: 32,"$9,500.00",True,5.0,https://ypcollective.com/products/red-cross-patch
Chrome Hearts,CH Buckle White Belt,N/A,N/A,True,5.0,https://ypcollective.com/products/ch-white-belt
Chrome Hearts,CH Buckle Blue Belt,N/A,N/A,True,5.0,https://ypcollective.com/products/blue-ch-belt
Chrome Hearts,Large Oval Cross White Belt,N/A,N/A,True,5.0,https://ypcollective.com/products/oval-cross-white-belt-copy
Chrome Hearts,Large Oval Cross Buckle Red Belt,Size: Red,"$5,000.00",True,5.0,https://ypcollective.com/products/oval-cross-buckle-red-belt
Chrome Hearts,Large Oval Cross Buckle Blue Belt,N/A,N/A,True,5.0,https://ypcollective.com/products/blue-oval-cross-belt
Chrome Hearts,1/1 Sex Records x Matty Boy x Nike Dunk Low,Size: 12,"$14,000.00",True,5.0,https://ypcollective.com/products/chrome-hearts-sex-records-matty-boy-nike-dunk
Chrome Hearts,Square Plus Cross Red Cross Patch Destroyer Belt,Size: 32,"$9,200.00",True,5.0,https://ypcollective.com/products/square-plus-cross-red-cross-patch-strap
Chrome Hearts,CH Buckle Cross Patch Belt,N/A,N/A,True,5.0,https://ypcollective.com/products/ch-belt-destroyer-cross-patch-strap
Chrome Hearts,CH Buckle Red Belt,N/A,N/A,True,5.0,https://ypcollective.com/products/ch-belt-red
Chrome Hearts,CH Horseshoe Floral Sleeve Pullover Hoodie,Size: L,$995.00,True,5.0,https://ypcollective.com/products/horseshoe-pullover-hoodie
Chrome Hearts, Cross Patched Chinos Brown,29,"$6,498",True,1.0,https://topdrwr.io/product/chrome-hearts-cross-patched-chinos29
Chrome Hearts, Cashmere Zip-Up Hoodie,Men's US XL,"$1,560",True,1.0,https://topdrwr.io/product/chrome-hearts-cashmere-zip-up-hoodie-mens-us-xl
Chrome Hearts, Leopard Belt,L,"$4,010",True,1.0,https://topdrwr.io/product/chrome-hearts-leopard-belt
Chrome Hearts, Acid Green Yellow Neon Neck Logo Black...,M,$360,True,1.0,https://topdrwr.io/product/chrome-hearts-acid-green-yellow-neon-neck-logo-black-t-shirt-l
Chrome Hearts, Bella Hadid Horseshoe Black T-Shirt Bl...,M,$390,True,1.0,https://topdrwr.io/product/chrome-hearts-bella-hadid-horseshoe-black-t-shirt-m
Chrome Hearts, Red neck logo horseshoe black tee Blac...,L,$510,True,1.0,https://topdrwr.io/product/chrome-hearts-red-neck-logo-horseshoe-black-tee-m
Chrome Hearts, Psych purple neck logo black tee Black,L,$360,True,1.0,https://topdrwr.io/product/chrome-hearts-psych-purple-neck-logo-black-tee-l
Chrome Hearts, Yellow Cross Made In Hollywood Black T...,XL,$360,True,1.0,https://topdrwr.io/product/chrome-hearts-yellow-cross-made-in-hollywood-black-tee-l
Chrome Hearts, Gradient dagger horseshoe white gradie...,M,$560,True,1.0,https://topdrwr.io/product/chrome-hearts-gradient-dagger-horseshoe-white-gradient-tee-xl
Chrome Hearts, New York Horseshoe White Tee Shirt Whi...,L,$410,True,1.0,https://topdrwr.io/product/chrome-hearts-new-york-horseshoe-white-tee-shirt-m
Chrome Hearts, Matty boy sadistic lipstick sick heart...,Men's US L,$460,True,1.0,https://topdrwr.io/product/chrome-hearts-matty-boy-sadistic-lipstick-sick-heart-tee-l
Chrome Hearts, Vine Dagger Hoodie Orange/Black Orange,Men's US 32,$959,True,1.0,https://topdrwr.io/product/chrome-hearts-vine-dagger-hoodie-orangeblack-mens-us-l
Chrome Hearts, x Levi's Leopard Star Patch Vintage Je...,XL,"$5,208",True,1.0,https://topdrwr.io/product/chrome-hearts-x-levis-leopard-star-patch-vintage-jeans-mens-us-32
Chrome Hearts, Silver Pencil Sharpener,Men's US M,"$1,710",True,1.0,https://topdrwr.io/product/chrome-hearts-silver-pencil-sharpener
Chrome Hearts, Matty Boy Build Thermal Orange,Men's US M,$540,True,1.0,https://topdrwr.io/product/chrome-hearts-matty-boy-build-thermal-xl
Chrome Hearts, Cross Pattern Stiff 2 Green Puffer Jac...,Men's US XL,"$6,950",True,1.0,https://topdrwr.io/product/chrome-hearts-cross-pattern-stiff-2-green-puffer-jacket-mens-us-m
Chrome Hearts, Star Print Baseball Tee White,Men's US M,$620,True,1.0,https://topdrwr.io/product/chrome-hearts-star-print-baseball-tee-mens-us-m
Chrome Hearts, × Comme des Garcons Short Sleeve T-Shi...,Men's US 30,$480,True,1.0,https://topdrwr.io/product/chrome-hearts-comme-des-garcons-short-sleeve-t-shirt-mens-us-xl
Chrome Hearts, Miami Music Week Exclusive Neon Green ...,Men's US 28,"$1,100",True,1.0,https://topdrwr.io/product/chrome-hearts-miami-music-week-exclusive-neon-green-hoodie-mens-us-m
Chrome Hearts, 99 Eyes Silver Baseball Bat,Men's US 11,"$49,960",True,1.0,https://topdrwr.io/product/chrome-hearts-99-eyes-silver-baseball-bat
Chrome Hearts, Silver Bicycle,Men's US 11,"$99,960",True,1.0,https://topdrwr.io/product/chrome-hearts-silver-bicycle
Chrome Hearts, Custom Denim Jeans with 4 Patches,Men's US 11,"$4,044",True,1.0,https://topdrwr.io/product/chrome-hearts-custom-denim-jeans-with-4-patches-mens-us-30
Chrome Hearts, Leather Double Knee Shorts,Men's US 10.5,"$4,280",True,1.0,https://topdrwr.io/product/chrome-hearts-leather-double-knee-shorts-mens-us-28
Chrome Hearts,Bape ×  Orange and Green Rare Sneakers,Men's US M,"$2,960",True,1.0,https://topdrwr.io/product/bape-chrome-hearts-orange-and-green-rare-sneakers-11
Chrome Hearts,Bape ×  2006 Purple Grey White Low Top ...,Men's US M,"$2,960",True,1.0,https://topdrwr.io/product/bape-chrome-hearts-2006-purple-grey-white-low-top-sneakers-11
Chrome Hearts,Bape Sta x  x Kaws 2006 Pink/Yellow Ste...,Men's US L,"$2,960",True,1.0,https://topdrwr.io/product/bape-sta-x-chrome-hearts-x-kaws-2006-pinkyellow-sterling-sneakers-11
Chrome Hearts,"Bape Sta x  2006 Red, White and Blue Sn...",Men's US M,"$2,960",True,1.0,https://topdrwr.io/product/bape-sta-x-chrome-hearts-2006-red-white-and-blue-sneakers-105
Chrome Hearts, Triple Cross Embroidered Cashmere Zip-...,Men's US L,"$4,460",True,1.0,https://topdrwr.io/product/chrome-hearts-triple-cross-embroidered-cashmere-zip-up-hoodie-mens-us-m
Chrome Hearts, Triple Cross Embroidery Cashmere Hoodi...,Men's US 38,"$4,660",True,1.0,https://topdrwr.io/product/chrome-hearts-triple-cross-embroidery-cashmere-hoodie-mens-us-m
Chrome Hearts, Tonal Neck Logo Long Sleeve Shirt,ONE SIZE,$460,True,1.0,https://topdrwr.io/product/chrome-hearts-tonal-neck-logo-long-sleeve-shirt-mens-us-l
Chrome Hearts, Leather Tag Tshirt,S,$260,True,1.0,https://topdrwr.io/product/chrome-hearts-leather-tag-tshirt-mens-us-m
Chrome Hearts, x Matty Boy Horseshoe Lips Hoodie,ONE SIZE,$760,True,1.0,https://topdrwr.io/product/chrome-hearts-x-matty-boy-horseshoe-lips-hoodie-mens-us-l
Chrome Hearts, Black Cemetery Cross Quilted Wallet,ONE SIZE,"$2,210",True,1.0,https://topdrwr.io/product/chrome-hearts-black-cemetery-cross-quilted-wallet
Chrome Hearts, Women's Cemetery Quilted Clutch,ONE SIZE,"$4,460",True,1.0,https://topdrwr.io/product/chrome-hearts-chrome-hearts-womens-cemetery-quilted-clutch
Chrome Hearts, Black Cemetery Cross Backpack,ONE SIZE,"$10,710",True,1.0,https://topdrwr.io/product/chrome-hearts-black-cemetery-cross-backpack
Chrome Hearts, x Rolex Datejust Watch,ONE SIZE,"$29,910",True,1.0,https://topdrwr.io/product/chrome-hearts-x-rolex-datejust-watch
Chrome Hearts, Miami City Jeans,US XL / EU 56 / 4,"$99,960",True,1.0,https://topdrwr.io/product/chrome-hearts-miami-city-jeans-mens-us-38
Chrome Hearts, Mini Crest Ring silver,ONE SIZE,$785,True,1.0,https://topdrwr.io/product/chrome-hearts-mini-crest-ring
Chrome Hearts, Puddles Cemetery Patch Coat Black,ONE SIZE,"$6,198",True,1.0,https://topdrwr.io/product/chrome-hearts-chrome-hearts-puddles-cemetery-patch-coat-s
Chrome Hearts, 25th Anniversary Denim & Leather Tote ...,ONE SIZE,"$2,740",True,1.0,https://topdrwr.io/product/chrome-hearts-25th-anniversary-denim-leather-tote
Chrome Hearts, BS Flare V Band Ring silver,ONE SIZE,"$1,440",True,1.0,https://topdrwr.io/product/chrome-hearts-bs-flare-v-band-ring
Chrome Hearts, Leather Shaving Handbag black,ONE SIZE,"$2,240",True,1.0,https://topdrwr.io/product/chrome-hearts-leather-shaving-handbag
Chrome Hearts, Trifold Nylon Wallet black,ONE SIZE,"$1,190",True,2.0,https://topdrwr.io/product/chrome-hearts-trifold-nylon-wallet
Chrome Hearts, Vine Dagger Charm silver,ONE SIZE,"$1,140",True,2.0,https://topdrwr.io/product/chrome-hearts-vine-dagger-charm
Chrome Hearts, x Matty Boy Chain Game Crewneck yellow,ONE SIZE,$965,True,2.0,https://topdrwr.io/product/chrome-hearts-x-matty-boy-chain-game-crewneck
Chrome Hearts, Camouflage Pattern Leather Shoulder Ba...,ONE SIZE,"$5,748",True,2.0,https://topdrwr.io/product/chrome-hearts-chrome-hearts-camouflage-pattern-leather-shoulder-bag-one-size
Chrome Hearts, Framed Plus Charm silver,M,$585,True,2.0,https://topdrwr.io/product/chrome-hearts-framed-plus-charm
Chrome Hearts, Framed Plus Pendant silver,ONE SIZE,$585,True,2.0,https://topdrwr.io/product/chrome-hearts-framed-plus-pendant
Chrome Hearts, Small Cross Cross Patch Quilted Wallet...,ONE SIZE,"$2,765",True,2.0,https://topdrwr.io/product/chrome-hearts-small-cross-cross-patch-quilted-wallet
Chrome Hearts, Kyosuke Himuro Dagger Dog Tag silver,ONE SIZE,$685,True,2.0,https://topdrwr.io/product/chrome-hearts-kyosuke-himuro-dagger-dog-tag
Chrome Hearts, Suede Pouch pink,ONE SIZE,$985,True,2.0,https://topdrwr.io/product/chrome-hearts-suede-pouch
Chrome Hearts, Scroll Label Cuff silver,ONE SIZE,"$2,190",True,2.0,https://topdrwr.io/product/chrome-hearts-scroll-label-cuff
Chrome Hearts, Dagger Heart Ring silver,ONE SIZE,"$1,190",True,2.0,https://topdrwr.io/product/chrome-hearts-dagger-heart-ring
Chrome Hearts, Eternity Vine Band silver,ONE SIZE,$610,True,2.0,https://topdrwr.io/product/chrome-hearts-eternity-vine-band
Chrome Hearts, Cross Button Leather Jacket Black,ONE SIZE,"$5,498",True,2.0,https://topdrwr.io/product/chrome-hearts-chrome-hearts-cross-button-leather-jacket-m
Chrome Hearts, Large Dog Tag Kyosuke Himuro Collabora...,S,$940,True,2.0,https://topdrwr.io/product/chrome-hearts-large-dog-tag-kyosuke-himuro-collaboration
Chrome Hearts, Quilted Cross Clutch yellow,ONE SIZE,"$2,440",True,2.0,https://topdrwr.io/product/chrome-hearts-quilted-cross-clutch
Chrome Hearts, Dagger Snat Pack Orange,ONE SIZE,"$6,598",True,2.0,https://topdrwr.io/product/chrome-hearts-chrome-hearts-dagger-snat-pack-one-size
Chrome Hearts, Double Fleur Clutch silver,ONE SIZE,"$2,640",True,2.0,https://topdrwr.io/product/chrome-hearts-double-fleur-clutch
Chrome Hearts, Distressed Leather Waistbag black,ONE SIZE,"$2,940",True,2.0,https://topdrwr.io/product/chrome-hearts-distressed-leather-waistbag
Chrome Hearts, Flare Zip Wallet black,US XL / EU 56 / 4,"$2,490",True,2.0,https://topdrwr.io/product/chrome-hearts-flare-zip-wallet
Chrome Hearts, Nylon Shoulder Bag black,ONE SIZE,"$2,940",True,2.0,https://topdrwr.io/product/chrome-hearts-nylon-shoulder-bag
Chrome Hearts, Mini Crest Ring silver,ONE SIZE,$785,True,2.0,https://topdrwr.io/product/chrome-hearts-mini-crest-ring
Chrome Hearts, Puddles Cemetery Patch Coat Black,ONE SIZE,"$6,198",True,2.0,https://topdrwr.io/product/chrome-hearts-chrome-hearts-puddles-cemetery-patch-coat-s
Chrome Hearts, BS Flare V Band Ring silver,ONE SIZE,"$1,440",True,2.0,https://topdrwr.io/product/chrome-hearts-bs-flare-v-band-ring
Chrome Hearts, Leather Shaving Handbag black,ONE SIZE,"$2,240",True,2.0,https://topdrwr.io/product/chrome-hearts-leather-shaving-handbag
Chrome Hearts, Trifold Nylon Wallet black,US 10 / EU 43,"$1,190",True,2.0,https://topdrwr.io/product/chrome-hearts-trifold-nylon-wallet
